{
  "id": "tripartition-tensors-small-cases-extension",
  "title": "Rank and border rank of the remaining small tripartitioning tensors; R(T_{1,1,c}) = C(c+2,2)+1",
  "statement": "Let T_{a,b,c} = Σ x_A y_B z_C over all ordered partitions (A, B, C) of [n], n = a + b + c, with |A| = a, |B| = b, |C| = c. (1) Upper bounds over every field of characteristic ≠ 2 (from the partial-Fourier note): R(T_{1,2,3}) ≤ 26, R(T_{1,2,4}) ≤ 42, R(T_{1,3,3}) ≤ 56, R(T_{2,2,3}) ≤ 57, R(T_{1,1,c}) ≤ C(c+2,2)+1. (2) Lower bounds on the border rank by Koszul–Young flattenings with explicit integer projections printed in the README (ranks computed modulo every prime q ≤ 31): ≥ 21 for T_{1,2,3} and ≥ 39 for T_{2,2,3} over ℂ and in characteristic 0 or q ≤ 31; ≥ 42 for T_{1,3,3} over ℂ and in characteristic 0 or 3 ≤ q ≤ 31; and, by the ordinary flattening, ≥ 35 for T_{1,2,4} and ≥ C(c+2,2) for T_{1,1,c} over every field. (3) For all a, b, c ≥ 1 and every field F, R_F(T_{a,b,c}) ≥ C(n,c) + 1: the space of slices along the third factor contains no rank-one matrix, while a tensor that is concise in a factor of dimension r and has rank r has a rank-one slice. (4) Hence R(T_{1,1,c}) = C(c+2,2)+1 for every c ≥ 1 over every field of characteristic ≠ 2 (for c = 3: R(T_{1,1,3}) = 11), C(c+2,2) ≤ border rank(T_{1,1,c}) ≤ C(c+2,2)+1, and 36 ≤ R(T_{1,2,4}) ≤ 42. The border rank of T_{1,1,c} for c ≥ 3 is left open.",
  "provenance": {
    "class": "own",
    "bases": []
  },
  "sources": [
    {
      "authors": "Pratt, K.",
      "year": 2023,
      "title": "A stronger connection between the asymptotic rank conjecture and the set cover conjecture",
      "venue": "arXiv preprint (v1, 5 November 2023)",
      "arxiv": "2311.02774",
      "url": "https://arxiv.org/abs/2311.02774v1",
      "note": "Listed to document the literature search; full text of v1 read. Balanced tensors T_k only; nothing on these tensors."
    },
    {
      "authors": "Björklund, A.; Kaski, P.; Koana, T.; Nederlof, J.",
      "year": 2026,
      "title": "Kronecker Scaling of Tensors with Applications to Arithmetic Circuits and Algorithms",
      "venue": "53rd International Colloquium on Automata, Languages, and Programming (ICALP 2026), LIPIcs, paper 36",
      "doi": "10.4230/LIPIcs.ICALP.2026.36",
      "arxiv": "2504.05772",
      "note": "Listed to document the literature search; full text read. No value or bound for these tensors."
    },
    {
      "authors": "Flavi, C.; Jelisiejew, J.; Michałek, M.",
      "year": 2025,
      "title": "Symmetric powers: structure, smoothability, and applications",
      "venue": "International Mathematics Research Notices 2025, rnaf277",
      "doi": "10.1093/imrn/rnaf277",
      "arxiv": "2408.02754",
      "note": "Base of the partial-Fourier note, which gives the upper bounds; arXiv v2 §6 read. Bounds for the balanced tensors only."
    },
    {
      "authors": "Landsberg, J. M.; Ottaviani, G.",
      "year": 2015,
      "title": "New lower bounds for the border rank of matrix multiplication",
      "venue": "Theory of Computing 11(1), 285-298",
      "doi": "10.4086/toc.2015.v011a011",
      "arxiv": "1112.6007",
      "note": "Credit for the Koszul flattening bound (Theorem 2.1 of arXiv:1112.6007v3, p. 3), proved in theorems/tripartition-tensor-p2-border-rank-at-least-26 (Lemma 3); not used as evidence."
    },
    {
      "authors": "Ye, K.; Lim, L.-H.",
      "year": 2018,
      "title": "Fast Structured Matrix Computations: Tensor Rank and Cohn–Umans Method",
      "venue": "Foundations of Computational Mathematics 18(1), 45-95",
      "doi": "10.1007/s10208-016-9332-x",
      "arxiv": "1601.00292",
      "note": "Read for the rank of T_{1,1,c}: arXiv:1601.00292v2, §14 (Theorem 14.1: symmetric matrix–vector product with the diagonal, rank n(n+1)/2 over ℂ) and §15 (skew-symmetric case, bounds only); the zero-diagonal symmetric case, which is T_{1,1,c}, is not treated there. The journal text was not read."
    },
    {
      "authors": "Ilten, N.; Teitler, Z.",
      "year": 2016,
      "title": "Product Ranks of the 3 × 3 Determinant and Permanent",
      "venue": "Canadian Mathematical Bulletin 59(2), 311-319",
      "doi": "10.4153/CMB-2015-076-1",
      "arxiv": "1503.00822",
      "note": "Background: Remark 2.2 of arXiv:1503.00822v2, p. 4 (the journal text was not read): the 3 × 3 permanent (= T_{1,1,1}) has tensor rank 4 in characteristic 0."
    },
    {
      "authors": "Han, J. I.; Song, J.",
      "year": 2026,
      "title": "The rank of the 5×5 permanent tensor is sixteen",
      "venue": "arXiv preprint (v2, 27 August 2026)",
      "arxiv": "2608.09708",
      "note": "Background: pp. 2–3 report rank and border rank 4 for the 3 × 3 permanent over fields of characteristic 0."
    },
    {
      "authors": "Doležálek, M.; Michałek, M.",
      "year": 2026,
      "title": "Nonlinear methods for tensors: determinantal equations for secant varieties beyond cactus",
      "venue": "arXiv preprint (v1)",
      "arxiv": "2602.12762",
      "note": "Listed to document the literature search; full text read. §6.3 mentions matching tensors among special tensors on which the new equations were not checked."
    }
  ],
  "verify": "python theorems/tripartition-tensors-small-cases-extension/verify.py",
  "proof": {
    "documents": [
      "README.md",
      "../tripartition-tensors-small-cases/README.md",
      "../tripartition-tensor-p2-border-rank-at-least-26/README.md",
      "../partial-fourier-bound-tripartition-tensors/README.md"
    ],
    "checks": [
      "verify.py",
      "../partial-fourier-bound-tripartition-tensors/verify.py"
    ],
    "audit": "RL-124"
  }
}
