{
  "id": "tripartition-tensors-small-cases",
  "title": "Rank and border rank of three small tripartitioning tensors",
  "statement": "Let T_{a,b,c} = Σ x_A y_B z_C over all ordered partitions (A, B, C) of [a+b+c] with |A| = a, |B| = b, |C| = c. (1) Explicit identities over ℤ with coefficients in {−1, 0, 1} (data/T112_rank7.json, T113_rank11.json, T122_rank14.json, SHA-256 pinned) give 4·T_{1,1,2}, 4·T_{1,1,3} and 4·T_{1,2,2} as sums of 7, 11 and 14 rank-one tensors, so over every field of characteristic ≠ 2 their ranks are at most 7, 11 and 14. (2) Their border ranks are at least 7 and 13 for T_{1,1,2} and T_{1,2,2} (Koszul–Young flattenings with p = 2, ranks of explicit 40 × 40 and 100 × 100 integer matrices computed modulo every prime q ≤ 31), over ℂ and over every field of characteristic 0 or of prime characteristic q ≤ 31; and at least 10 for T_{1,1,3} over every field (flattening). (3) Hence R(T_{1,1,2}) = border rank(T_{1,1,2}) = 7 over ℂ and over every field of characteristic 0 or 3 ≤ q ≤ 31; 10 ≤ border rank ≤ R(T_{1,1,3}) ≤ 11 in characteristic ≠ 2; 13 ≤ border rank ≤ R(T_{1,2,2}) ≤ 14 over ℂ and in characteristic 0 or 3 ≤ q ≤ 31.",
  "provenance": {
    "class": "own",
    "bases": []
  },
  "sources": [
    {
      "authors": "Pratt, K.",
      "year": 2023,
      "title": "A stronger connection between the asymptotic rank conjecture and the set cover conjecture",
      "venue": "arXiv preprint (v1, 5 November 2023)",
      "arxiv": "2311.02774",
      "url": "https://arxiv.org/abs/2311.02774v1",
      "note": "Listed to document the literature search; full text of v1 read. Balanced tensors T_k only; nothing on these three tensors."
    },
    {
      "authors": "Björklund, A.; Kaski, P.; Koana, T.; Nederlof, J.",
      "year": 2026,
      "title": "Kronecker Scaling of Tensors with Applications to Arithmetic Circuits and Algorithms",
      "venue": "53rd International Colloquium on Automata, Languages, and Programming (ICALP 2026), LIPIcs, paper 36",
      "doi": "10.4230/LIPIcs.ICALP.2026.36",
      "arxiv": "2504.05772",
      "note": "Listed to document the literature search; full text read. No value or bound for a fixed tensor."
    },
    {
      "authors": "Flavi, C.; Jelisiejew, J.; Michałek, M.",
      "year": 2025,
      "title": "Symmetric powers: structure, smoothability, and applications",
      "venue": "International Mathematics Research Notices 2025, rnaf277",
      "doi": "10.1093/imrn/rnaf277",
      "arxiv": "2408.02754",
      "note": "Listed to document the literature search; arXiv v2 §6 read. Bounds for the balanced tensors only."
    },
    {
      "authors": "Landsberg, J. M.; Ottaviani, G.",
      "year": 2015,
      "title": "New lower bounds for the border rank of matrix multiplication",
      "venue": "Theory of Computing 11(1), 285-298",
      "doi": "10.4086/toc.2015.v011a011",
      "arxiv": "1112.6007",
      "note": "Credit for the Koszul flattening bound (Theorem 2.1 of arXiv:1112.6007v3, p. 3), proved in theorems/tripartition-tensor-p2-border-rank-at-least-26 (Lemma 3); not used as evidence."
    },
    {
      "authors": "Ye, K.; Lim, L.-H.",
      "year": 2018,
      "title": "Fast Structured Matrix Computations: Tensor Rank and Cohn–Umans Method",
      "venue": "Foundations of Computational Mathematics 18(1), 45-95",
      "doi": "10.1007/s10208-016-9332-x",
      "arxiv": "1601.00292",
      "note": "Background, context only: Theorem 14.1 of arXiv:1601.00292v2, p. 27 (over ℂ: symmetric matrix–vector product with diagonal, rank n(n+1)/2; the journal text was not read); the zero-diagonal case, which is T_{1,1,c}, is not treated there."
    },
    {
      "authors": "Ilten, N.; Teitler, Z.",
      "year": 2016,
      "title": "Product Ranks of the 3 × 3 Determinant and Permanent",
      "venue": "Canadian Mathematical Bulletin 59(2), 311-319",
      "doi": "10.4153/CMB-2015-076-1",
      "arxiv": "1503.00822",
      "note": "Background: Remark 2.2 of arXiv:1503.00822v2, p. 4 (the journal text was not read): the 3 × 3 permanent (= T_{1,1,1}) has tensor rank 4 in characteristic 0."
    },
    {
      "authors": "Han, J. I.; Song, J.",
      "year": 2026,
      "title": "The rank of the 5×5 permanent tensor is sixteen",
      "venue": "arXiv preprint (v2, 27 August 2026)",
      "arxiv": "2608.09708",
      "note": "Background: pp. 2–3 report rank and border rank 4 for the 3 × 3 permanent over fields of characteristic 0 (border rank ≥ 4: Derksen–Makam 2019, not read directly; the value with Fischer's formula)."
    }
  ],
  "verify": "python theorems/tripartition-tensors-small-cases/verify.py",
  "proof": {
    "documents": [
      "README.md",
      "../tripartition-tensor-p2-border-rank-at-least-26/README.md",
      "../partial-fourier-bound-tripartition-tensors/README.md"
    ],
    "checks": [
      "verify.py",
      "../partial-fourier-bound-tripartition-tensors/verify.py"
    ],
    "audit": "RL-119"
  }
}
